[
  {"event_id":"evt-0001","run_id":"icml-2026-0421","sequence":1,"occurred_at":"2026-05-03T09:12:00.000Z","type":"system.run.created","actor":{"agent_id":"watchdog","role":"system","phase":"run"},"payload":{"mode":"live_submission"}},
  {"event_id":"evt-0002","run_id":"icml-2026-0421","sequence":2,"occurred_at":"2026-05-03T09:14:18.000Z","type":"reviewer.initial_review.task_started","actor":{"agent_id":"reviewer-r2","role":"reviewer","phase":"initial_review"},"payload":{"task_id":"theory-audit"}},
  {"event_id":"evt-0003","run_id":"icml-2026-0421","sequence":3,"occurred_at":"2026-05-15T13:40:09.000Z","type":"validator_mathematics.symbolic_validation.finding_confirmed","actor":{"agent_id":"validator-math-1","role":"validator_mathematics","phase":"symbolic_validation"},"payload":{"finding_id":"MATH-12"}},
  {"event_id":"evt-0004","run_id":"icml-2026-0421","sequence":4,"occurred_at":"2026-05-19T10:08:31.000Z","type":"reviewer.initial_review.artifact_published","actor":{"agent_id":"reviewer-r2","role":"reviewer","phase":"initial_review"},"payload":{"artifact_id":"official-review-r2","artifact_type":"official_review","version":1}},
  {"event_id":"evt-0005","run_id":"icml-2026-0421","sequence":5,"occurred_at":"2026-05-27T14:21:10.000Z","type":"author.rebuttal.published","actor":{"agent_id":"author-coordinator","role":"author","phase":"rebuttal"},"payload":{"artifact_id":"rebuttal-ablation","artifact_type":"author_rebuttal","version":1}},
  {"event_id":"evt-0006","run_id":"icml-2026-0421","sequence":6,"occurred_at":"2026-06-01T08:47:03.000Z","type":"reviewer.followup.score_changed","actor":{"agent_id":"reviewer-r2","role":"reviewer","phase":"followup"},"payload":{"reviewer_id":"R2","field":"overall","from":4,"to":5}},
  {"event_id":"evt-0007","run_id":"icml-2026-0421","sequence":7,"occurred_at":"2026-06-04T11:20:00.000Z","type":"ac.discussion.issue_opened","actor":{"agent_id":"area-chair-17","role":"ac","phase":"discussion"},"payload":{"issue_id":"DISC-001"}},
  {"event_id":"evt-0008","run_id":"icml-2026-0421","sequence":8,"occurred_at":"2026-06-09T15:02:45.000Z","type":"ac.discussion.issue_resolved","actor":{"agent_id":"area-chair-17","role":"ac","phase":"discussion"},"payload":{"issue_id":"DISC-001","resolution":"assumption_clarified"}},
  {"event_id":"evt-0009","run_id":"icml-2026-0421","sequence":9,"occurred_at":"2026-06-11T19:11:05.000Z","type":"ac.meta_review.published","actor":{"agent_id":"area-chair-17","role":"ac","phase":"meta_review"},"payload":{"artifact_id":"meta-review","artifact_type":"meta_review","version":1}},
  {"event_id":"evt-0010","run_id":"icml-2026-0421","sequence":10,"occurred_at":"2026-06-15T10:30:22.000Z","type":"sac.calibration.completed","actor":{"agent_id":"sac-3","role":"sac","phase":"calibration"},"payload":{"recommendation":"spotlight"}},
  {"event_id":"evt-0011","run_id":"icml-2026-0421","sequence":11,"occurred_at":"2026-06-18T16:03:55.000Z","type":"projector.snapshot.published","actor":{"agent_id":"projector","role":"projector","phase":"snapshot"},"payload":{"state_hash":"sha256:23b006a91d17f4be7d5c89a620ef6c66ef10dcd684455a5d87815eb1ac01ca4a"}},
  {"event_id":"evt-0012","run_id":"icml-2026-0421","sequence":12,"occurred_at":"2026-06-18T16:04:12.000Z","type":"pc.finalization.decision_published","actor":{"agent_id":"program-chairs","role":"pc","phase":"finalization"},"payload":{"decision":"accept_spotlight"}}
]
